{
  "$schema": "office-corpus.schema.json",
  "schemaVersion": 1,
  "updated": "2026-09-06",
  "fonts": [
    "Liberation Serif",
    "Liberation Sans",
    "Liberation Mono",
    "DejaVu Sans"
  ],
  "toolFonts": [
    "OpenSymbol",
    "SymbolMT",
    "StarSymbol"
  ],
  "targets": [
    "docx",
    "odt",
    "rtf",
    "html"
  ],
  "seeds": [
    {
      "id": "plain-paragraphs",
      "why": "The floor. Three paragraphs of ordinary prose, so a failure here is never about a construct - it is about the path, the font, the page box or the conversion itself, and every other seed in this file can then be read as a difference from this one. A suite whose simplest case fails has nothing to say about its hardest.",
      "html": "<html><head><meta charset=\"utf-8\"><title>plain-paragraphs</title><style>@page { size: 21.59cm 27.94cm; margin: 2.54cm }</style></head><body style=\"font-family:'Liberation Serif';font-size:12pt\"><p>One paragraph of ordinary prose, with nothing in it that any of the four target formats has to think about.</p><p>A second paragraph, because the boundary between two of them is a thing a converter can lose on its own, without touching a character of either.</p><p>A third, so that the paragraph count this seed asserts is a count and not a pair.</p></body></html>",
      "expect": {
        "minParagraphs": 3,
        "multipage": false,
        "substitutesFonts": false
      },
      "textIgnore": []
    },
    {
      "id": "inline-formatting",
      "why": "The four character toggles, each on its own word and each with a plain space on both sides. The spaces are the load-bearing part: a converter that mis-attributes the space between two runs changes no visible character and would pass any check that compared only text, so the seed puts a boundary on either side of every toggle. The third paragraph nests one toggle inside another, which is the case a writer tracking a single current style gets wrong.",
      "html": "<html><head><meta charset=\"utf-8\"><title>inline-formatting</title><style>@page { size: 21.59cm 27.94cm; margin: 2.54cm }</style></head><body style=\"font-family:'Liberation Serif';font-size:12pt\"><p><b>Bold</b> <i>italic</i> <u>underline</u> <s>struck</s> normal.</p><p>The same four inside a sentence: a <b>bold</b> word, an <i>italic</i> word, an <u>underlined</u> word and a <s>struck</s> word, each with a plain space on both sides of it.</p><p><b>Bold, with <i>italic inside it</i>, and bold again</b>, so that a nested run has to survive as well as a flat one.</p></body></html>",
      "expect": {
        "minParagraphs": 3,
        "multipage": false,
        "substitutesFonts": false
      },
      "textIgnore": []
    },
    {
      "id": "colour-and-highlight",
      "why": "Colour twice over, because a run property and a paragraph property look the same on the page and are not the same thing. Highlight is here rather than in the inline seed because it is the one of the two that several formats carry as a fixed palette rather than as a value: a converter that snapped this yellow to the nearest of sixteen named highlights has done something defensible, and this seed is where that gets seen and decided rather than discovered.",
      "html": "<html><head><meta charset=\"utf-8\"><title>colour-and-highlight</title><style>@page { size: 21.59cm 27.94cm; margin: 2.54cm }</style></head><body style=\"font-family:'Liberation Serif';font-size:12pt\"><p><span style=\"color:#B71C1C\">A foreground colour</span> and <span style=\"background-color:#FFF59D\">a highlight</span> and plain text after both of them.</p><p style=\"color:#1B5E20\">A whole paragraph in a foreground colour, which is the property stated on the paragraph rather than on a run inside it.</p><p><span style=\"color:#0D47A1;background-color:#FFF59D\">Both at once on one run</span>, which is where a format carrying only one of the two has to choose.</p></body></html>",
      "expect": {
        "minParagraphs": 3,
        "multipage": false,
        "substitutesFonts": false
      },
      "textIgnore": []
    },
    {
      "id": "headings-and-outline",
      "why": "Three outline levels with a paragraph under each. The point is the outline rather than the type: a heading that survives as bold text of the right size has lost the thing a table of contents, a navigator and an accessibility tree all read, and it has lost it invisibly. The headings are set in Liberation Sans over a Liberation Serif body because that is the ordinary shape of a document and because it gives the family a second place to be dropped.",
      "html": "<html><head><meta charset=\"utf-8\"><title>headings-and-outline</title><style>@page { size: 21.59cm 27.94cm; margin: 2.54cm }</style></head><body style=\"font-family:'Liberation Serif';font-size:12pt\"><h1 style=\"font-family:'Liberation Sans'\">A first level heading</h1><p>Body text under the first level, so that the heading has something to be a heading of.</p><h2 style=\"font-family:'Liberation Sans'\">A second level heading</h2><p>Body text under the second level.</p><h3 style=\"font-family:'Liberation Sans'\">A third level heading</h3><p>Body text under the third level, and the outline is three deep by the time this paragraph is reached.</p></body></html>",
      "expect": {
        "minParagraphs": 3,
        "multipage": false,
        "substitutesFonts": false
      },
      "textIgnore": []
    },
    {
      "id": "lists-nested",
      "why": "Both list kinds, each nested one level, with a paragraph on either side. The outer paragraphs are load-bearing - list state must not leak into the prose around it - and the nesting is what separates a format that carries a list from one that carries an indent and a glyph. The expectation asks only for the two prose paragraphs, because whether a list item counts as a paragraph is a question each target answers differently and not one this seed is trying to settle.",
      "html": "<html><head><meta charset=\"utf-8\"><title>lists-nested</title><style>@page { size: 21.59cm 27.94cm; margin: 2.54cm }</style></head><body style=\"font-family:'Liberation Serif';font-size:12pt\"><p>An introductory paragraph, outside every list.</p><ul><li>first bullet</li><li>second bullet<ul><li>nested bullet</li><li>second nested bullet</li></ul></li><li>third bullet, back at the outer level</li></ul><ol><li>ordered one</li><li>ordered two<ol><li>nested ordered one</li><li>nested ordered two</li></ol></li></ol><p>A trailing paragraph, outside every list, because list state must not leak into the prose around it.</p></body></html>",
      "expect": {
        "minParagraphs": 2,
        "multipage": false,
        "substitutesFonts": false
      },
      "textIgnore": [
        {
          "pattern": "(?:[0-9]+[.)]|[\\u2022\\u25cf\\u25aa\\u25e6])\\t",
          "why": "The generated list label, matched together with the tab that follows it. A bullet glyph and an autonumber come from the list definition rather than from the author, and which target puts one in the text is not a question about the document: DOCX writes a numPr and a numbering part and no glyph anywhere, ODT and HTML write the list structure and no glyph either, and RTF writes the label into the text stream as a {\\listtext ...} group carrying the bullet character and a tab. The tab is what makes this safe to match without an anchor, since no seed in this corpus has a tab anywhere in its prose. Without the label the four targets agree about every character the seed actually wrote, and with it they cannot."
        }
      ]
    },
    {
      "id": "table-simple",
      "why": "Three rows and two columns with a header row, and nothing else - no spans, no nested table, no stated width. A table is the construct where the four targets diverge most and where the divergence is easiest to blame on the wrong thing, so the first table in this corpus is the one with no cell anybody could argue about. The borders are stated because a table that arrives with none looks identical to a table that arrived as paragraphs.",
      "html": "<html><head><meta charset=\"utf-8\"><title>table-simple</title><style>@page { size: 21.59cm 27.94cm; margin: 2.54cm }</style></head><body style=\"font-family:'Liberation Serif';font-size:12pt\"><p>A paragraph before the table.</p><table style=\"border-collapse:collapse\"><tr><th style=\"border:1px solid #000000\">head a</th><th style=\"border:1px solid #000000\">head b</th></tr><tr><td style=\"border:1px solid #000000\">cell a</td><td style=\"border:1px solid #000000\">cell b</td></tr><tr><td style=\"border:1px solid #000000\">cell c</td><td style=\"border:1px solid #000000\">cell d</td></tr></table><p>A paragraph after the table.</p></body></html>",
      "expect": {
        "minParagraphs": 2,
        "multipage": false,
        "substitutesFonts": false
      },
      "textIgnore": []
    },
    {
      "id": "links",
      "why": "Two schemes and two positions. example.org is reserved by RFC 2606, so nothing in this corpus names a host anybody owns, and mailto is here because it is the scheme that several writers turn into a field rather than into a hyperlink. The second paragraph puts a link in the middle of a sentence rather than at the start of one, which is where a converter that rebuilds a paragraph around its links gets the surrounding text wrong.",
      "html": "<html><head><meta charset=\"utf-8\"><title>links</title><style>@page { size: 21.59cm 27.94cm; margin: 2.54cm }</style></head><body style=\"font-family:'Liberation Serif';font-size:12pt\"><p><a href=\"https://example.org/\">An absolute link</a> and <a href=\"mailto:someone@example.org\">a mail link</a> and plain text, all in one paragraph.</p><p>A paragraph with <a href=\"https://example.org/second\">a second absolute link</a> in the middle of it, so that a link is exercised somewhere other than at a paragraph boundary.</p></body></html>",
      "expect": {
        "minParagraphs": 2,
        "multipage": false,